Author,Title,Lyrics,Album,Views,Release.Date
Fetty Wap,679,"[Produced by Peoples]

[Intro: Fetty Wap]
Yeaaah baby, 17
(RemyBoy Lifestyle)
Ay, ay, look

[Verse 1: Fetty Wap]
Baby girl, you're so damn fine, though
I'm tryna know if I could hit it from behind, though
I'm sipping on you like some fine wine, though
And when it's over, I press rewind though, ayy
You talking bands, girl, I got it
Benjamins all in my pocket
I traded in my Trues for some Robins
He playing Batman, Fetty's gon' rob him, ayy
I got a Glock in my 'Rari, ayy
17 shots, no .38
I got a Glock in my 'Rari
17 shots, no .38

[Chorus: Fetty Wap]
I'm like, yeah, she's fine
Wonder when she'll be mine
She walk past, I press rewind
To see that ass one more time
And I got this sewed up
Remy Boyz, they know us
All fast money, no slow bucks
No one can control us
Ayy, yeaaah baby

[Verse 2: Montana Bucks]
Uh, yeah, Monty
Tell me what you see
Is it money or it’s me?
I smoke twenty, smell the weed
I got hunnies in my V
They like, ""Monty, can you be my baby daddy?""
I’m like, ""Yeah""
I got Robins on my jeans
You see the wings on every pair
All you see is Remy Boyz
You know my niggas everywhere
And if somebody got a problem
We could meet up anywhere
Now go say something
Don’t you niggas play dumb
You know where we came from
You don’t want sauce, no A1

[Chorus: Fetty Wap]
I'm like, yeah, she's fine
Wonder when she'll be mine
She walk past, I press rewind
To see that ass one more time
And I got this sewed up
Remy Boyz, they know us
All fast money, no slow bucks
No one can control us
Ayy, yeaaah baby

[Verse 3: Fetty Wap]
Ayy, they think they know us
They can't control us
Man, I got this sewed up
Remy Boyz, they know us
679, this is Zoo year, baby
Monty and the Zoovier, baby
ZooGang, all my zoo near, baby, yeah, baby
A thousand on my shoes when I walk through, baby
10.5 for a walkthrough, baby
ZooGang, you know my whole zoo near
And baby, I'm Zoovier

[Removed for album: P-Dice]
Ayy, she a cutie and she fine, make me wanna make her mine
She ain't nothing like them bimbos
If you like it, we can swerve, we can light and stain up here
Blowing, pluck it out the window
We get playing, press rewind, got her singing every time
Take a high note for me, girlfriend
Got my city looking rude
I ain't Diddy, I ain't Loon, but I think I need a girlfriend
She feeling great as I'm talking to her
She a RemyGirl, so I'm gon' pursue her
I brought a lot of loud, lot of Remy to sip on
Thousand dollars when I get my tip on
I'm off her, asked her if her fatty real
She said that's all her, got her with the happy feel
I'm 'bout to spoil her, got her with the happy feel
I'm 'bout to spoil her, oh my

[Chorus: Fetty Wap]
I'm like, yeah, she's fine
Wonder when she'll be mine
She walk past, I press rewind
Just to see that ass one more time
And I got this sewed up
Remy Boyz, they know us
All fast money, no slow bucks
No one can control us
Ayy, yeaaah baby

[Outro: Fetty Wap]
ZooWap, Monty
ZooWap, Dicey
Yeaah baby, Remy Boyz
Yeaah, yeaaah",Up Next,3.9M,"June 29, 2015"
Post Malone,White Iverson,"[Intro]
Double OT
I'm a new three

[Chorus]
Saucin', saucin', I'm saucin' on you
I'm swaggin', I'm swaggin', I'm swaggin', oh-ooh
I'm ballin', I'm ballin', Iverson on you (Swish, ooh, ayy)
Watch out, watch out, watch out, yeah
That's my shot, that's my shot, that's my shot, yeah
Spendin', I'm spendin' all my fuckin' pay

[Verse 1]
I got me some braids and I got me some hoes
Started rockin' the sleeve, I can't ball with no Joes
You know how I do it, Concords on my toes
(This shit is hard), ooh
I ain't rich yet, but you know I ain't broke, I
So if I see it, I like it, buy that from the store, I
I'm with some white girls and they lovin' the coca
Like they OT
Double OT like I'm KD, smokin' OG
And you know me, in my 2-3s and my gold teeth
Bitch, I'm smiling, bet you see me from the nosebleeds
I'm a new three and I change out to my new 3s

[Pre-Chorus]
White Iverson
When I started ballin', I was young
You gon' think about me when I'm gone
I need that money like the ring I never won, I won

[Chorus]
Saucin', saucin', I'm saucin' on you
I'm swaggin', I'm swaggin', I'm swaggin', oh-ooh
I'm ballin', I'm ballin', Iverson on you
Watch out, watch out, watch out, yeah
That's my shot, that's my shot, that's my shot, yeah
Spendin', I'm spendin' all my fuckin' pay

[Verse 2]
Ooh, Stoney
Cigarettes and a headband
Commas, commas in my head, man
Slumped over like a dead man
Red and black, 'bout my bread, man
I'm the answer, never question
Lace up, learn a lesson
Bitch, I'm saucin', I do this often, don't do no talkin'
My options right when I walk in, jump all them Jordans
I'm ballin', money jumpin'
Like I'm Davis from New Orleans
Or bitch I'm Harden, I don't miss nothin'
Fuck practice, this shit just happens, know y'all can't stand it
I have it, I never pass it, I work my magic
High average, ball on these bastards, it makes me happy
It's tragic, I make it happen, and all y'all Shaqtin'

[Pre-Chorus]
White Iverson
When I started ballin' I was young
You gon' think about me when I'm gone
I need that money like the ring I never won, I won

[Chorus]
Saucin', saucin', I'm saucin' on you
I'm swaggin', I'm swaggin', I'm swaggin', oh-ooh
I'm ballin', I'm ballin', Iverson on you
Watch out, watch out, watch out, yeah
That's my shot, that's my shot, that's my shot, yeah
Spendin', I'm spendin' all my fuckin' pay",Stoney,3.9M,"February 4, 2015"
"Migos, Nicki Minaj & Cardi B",MotorSport,"[Intro: Quavo]
Yeah, woo, yeah, skrrt
M-M-M-Murda

[Chorus: Quavo]
Motorsport, yeah, put that thing in sport (Skrrt, skrrt)
Shawty bad (Bad), pop her like a cork (Pop it)
You a dork, never been a sport (Dork, yeah)
Pull up, woo, woo, jumpin' out the court (Jump)
Cotton candy (Drink), my cup tastes like the fair (Cotton)
Straight up there (Where?), we didn't take the stairs (Where?)
Faced my fears (My fears), gave my mama tears (Mama)
Shiftin' gears (Shift), on the Nawf, get serious (Serious)

[Verse 1: Quavo]
Face all your fears, then get at me
Hit so many donuts on them backstreets
Sit so high in the nosebleeds (Yeah)
Feel like I can fly, yeah
Xans, Perky, check (Yeah), Bill Belichick
Take the air out the ball (Ooh), just so I can flex
Take the air out the mall, walk in with the sacks
Take the air out your broad (Hey), now she can't go back (E)
Xans, Perky, check (Yeah), Bill Belichick
Take the air out the ball (Yeah), just so I can flex
Take the air out the mall (Hey), walk in with the sacks
Take the air out your broad (Woo, woo, woo, E)

[Verse 2: Offset]
Offset!
Uh, the coupe came imported (Hey)
This season's Off-White come in snorted (White)
Green Lamborghini a tortoise (Lambo)
No human being, I'm immortal (No)
Patek and A.P. full of water (Patek)
Hundred K, I spend on my señora (Racks)
My pinky on margarine, butter (Margarine)
And my ears got McDonald's nuggets (Ayy)
Soon, as I land on the Lear (Whew)
Piguets, they wet, tears ('Guets)
488, hit the gears (488)
Suicide doors, Britney Spears
I'm boujee, so, bitch, don't get near (Boujee)
Criss Angel, make dope disappear (Voilà)
Hit the gas, it got flames out the rears (Skrrt)
It's a race to the bag, get the mills (Hey)

[Verse 3: Cardi B]
Ride the dick like a BMX
No nigga wanna be my ex (No)
I love when he go on tour
'Cause he cums more, when I see him less
I get up set off
I turn Offset on
I told him the other day
Man, we should sell that porn
Yeah, Cardi B, I'm back, bitches
I don't wanna hear I'm actin' different (Yeah)
Same lips that be talkin' 'bout me
Is the same lips that be ass kissin'
These hoes ain't what they say they are
And their pussy stank, they catfishin'
Same hoes that was sendin' shots
They reachin' out like they back itchin' (Whoo)
Why would I hop in some beef (Why?)
When I could just hop in a Porsche?
You heard she gon' do what from who?
That's not a reliable source, no
So tell me, have you seen her?
Let me wrap my weave up
I'm the trap Selena
¡Dame más gasolina! Skrrt!

[Chorus: Quavo]
Motorsport, yeah, put that thing in sport (Skrrt, skrrt)
Shawty bad (Bad), pop her like a cork (Pop it)
You a dork, never been a sport (Dork, yeah)
Pull up, woo, woo, jumpin' out the court (Jump)

[Verse 4: Nicki Minaj]
Uh, yo, watch your man, then you should watch your mouth
Bitches is pressed, administer mouth to mouth
You see them stats, you know what I am about
I am the champ, I'm Iron Mike in a bout
Attention, I'ma need you to face front
You don't want smoke with me, this is a laced blunt
Rap's Jackie Chan, we ain't pullin' them fake stunts
My crown won't fit on your bum-ass lace fronts (Uh)
You bitches catchin' a fade, shout out my nigga Lil Boosie
All of your friends'll be dead, you can get hit with that Uzi
I call him Ricky, he say he love me like Lucy
Get you a straw nigga, you know this pussy is juicy
This Givenchy is custom made, now you can't get it at Saks though
I don't work in no office, but they copyin' and that's facts though
I ain't tryna be violent, but if Nicki on it, it slaps, ho
Get you lined for that paper like a loose leaf when that strap blow
I'm with a couple bad bitches that'll rip the party
If Quavo the QB, I'm Nick Lombardi
Pull up in the space coupe, I done linked with Marty
I can actually afford to get a pink Bugatti
""Ayo, Nick, didn't you just do a hit with Gotti?""
That too, but my niggas send hits like Gotti
It's a wrap, like the things on the head of a Saudi
Bitch, you my son, go and sit on the potty (Rrrrrr)

[Verse 5: Takeoff]
Brand new Chanels (Chanels)
I scuffed 'em runnin' from 12 (12)
Ain't make no commitment with none of you bitches
'Cause money is treatin' me well (Uh-uh)
If Nicki should show me her titty
Right hand on the Bible, I swear I won't tell (Swear)
If I get to play with that kitty
I wonder how many platinums we gon' sell (Albums)
Pop a Perc and catch a feel (I pop one)
Now I cannot feel the wheel (Woah)
My chest bad, give me chills (Ice)
And the left hand on Richard Mille (Ice)
Not the watch, but the price on the ice
If you don't know what that is (Huh)
Motorsport, motorville
Abort the mission, that's a kill (Pew, pew, brrr)

[Chorus: Quavo]
Motorsport, yeah, put that thing in sport (Skrrt, skrrt)
Shawty bad (Bad), pop her like a cork (Pop it)
You a dork, never been a sport (Dork, yeah)
Pull up, woo, woo, jumpin' out the court (Jump)
Cotton candy (Drink), my cup tastes like the fair (Cotton)
Straight up there (Where?), we didn't take the stairs (Where?)
Faced my fears (My fears), gave my mama tears (Mama)
Shiftin' gears (Shift), on the Nawf, get serious (Serious)

[Outro: Quavo]
Girl, yeah, yeah, I wish my grandma could see me (Grandma)
Take away pain, ain't easy (Pain)
That's why I fire up a bleezy (Fire)
Niggas not cappin' this season",Culture II,3.8M,"October 27, 2017"
Childish Gambino,Redbone,"[Verse 1]
Daylight
I wake up feeling like you won't play right
I used to know, but now that shit don't feel right
It made me put away my pride
So long
You made a nigga wait for some, so long
You make it hard for boy like that to go on
I'm wishing I could make this mine, oh

[Pre-Chorus]
If you want it, yeah
You can have it, oh, oh, oh
If you need it, ooh
We can make it, oh
If you want it
You can have it

[Chorus]
But stay woke
Niggas creepin'
They gon' find you
Gon' catch you sleepin' (Ooh)
Now stay woke
Niggas creepin'
Now don't you close your eyes

[Verse 2]
Too late
You wanna make it right, but now it's too late
My peanut butter chocolate cake with Kool-Aid
I'm trying not to waste my time

[Pre-Chorus]
If you want it, oh
You can have it, you can have it
If you need it
You better believe in something
We can make it
If you want it
You can have it, ah!

[Chorus]
But stay woke (Stay woke!)
Niggas creepin' (They be creepin')
They gon' find you (They gon' find you)
Gon' catch you sleepin' (Gon' catch you sleepin', put your hands up now, baby)
Ooh, now stay woke
Niggas creepin'
Now, don't you close your eyes
But stay woke, ooh
Niggas creepin' (They gon' find you!)
They gon' find you
Gon' catch you sleepin', ooh
Now stay woke
Niggas creepin'
Now, don't you close your eyes

[Outro]
How'd it get so scandalous?
How'd it get so scandalous?
(Oh, oh, baby you, how'd it get...)
How'd it get so scandalous?
How'd it get so scandalous?
But stay woke
But stay woke","“Awaken, My Love!”",3.8M,"November 17, 2016"
The Weeknd,Can’t Feel My Face,"[Produced by Max Martin]

[Verse 1]
And I know she'll be the death of me
At least we'll both be numb
And she'll always get the best of me
The worst is yet to come
But at least we'll both be beautiful and stay forever young
This I know, yeah, this I know

[Pre-Chorus]
She told me, ""don't worry about it""
She told me, ""don't worry no more""
We both know we can't go without it
She told me you'll never be alone, oh, oh, woo

[Chorus]
I can't feel my face when I'm with you
But I love it, but I love it, oh
I can't feel my face when I'm with you
But I love it, but I love it, oh

[Verse 2]
And I know she'll be the death of me
At least we'll both be numb
And she'll always get the best of me
The worst is yet to come
All the misery was necessary when we're deep in love
This I know, girl, I know

[Pre-Chorus]
She told me, ""don't worry about it""
She told me, ""don't worry no more""
We both know we can't go without it
She told me you'll never be alone, oh, oh, woo

[Chorus]
I can't feel my face when I'm with you
But I love it, but I love it, oh
I can't feel my face when I'm with you
But I love it, but I love it, oh
I can't feel my face when I'm with you
But I love it, but I love it, oh
I can't feel my face when I'm with you
But I love it, but I love it, oh

[Pre-Chorus]
She told me, ""don't worry about it""
She told me, ""don't worry no more""
We both know we can't go without it
She told me you'll never be alone, oh, oh, woo

[Chorus]
I can't feel my face when I'm with you
But I love it, but I love it, oh
I can't feel my face when I'm with you
But I love it, but I love it, oh
I can't feel my face when I'm with you
But I love it, but I love it, oh
I can't feel my face when I'm with you
But I love it, but I love it, oh",Beauty Behind the Madness,3.8M,"June 8, 2015"
Drake,All Me,"[Produced by Key Wane]

[Intro: Aziz Ansari]
I'm really stepping up my game
These bitches gotta start paying me for this
Can't get no more free, Randy

[Chorus: Drake]
Got everything, I got everything
I cannot complain, I cannot
I don't even know how much I really made, I forgot, it's a lot
Fuck that, never mind what I got
Nigga don't watch that 'cause I—
Came up, that's all me, stay true, that's all me
No help, that's all me, all me for real
Came up, that's all me, stay true, that's all me
No help, that's all me, all me for real

[Verse 1: 2 Chainz]
Money on my mind, you should think the same
J's on, pinky ring, dogging these hoes, I need quarantine
In the same league, but we don't ball the same
(Ah) She want all the fame, I hear that shit all the time
She said she love me, I said, ""Baby girl, fall in line""
Okay, made a million off a dinner fork, watch me switch it up
Walked in, ""Ill nigga alert! Ill nigga alert!""
You need that work, I got that work, got bitches in my condo
Just bought a shirt that cost a Mercedes-Benz car note
From the A to Toronto, we let the metal go off
And my dick so hard it make the metal detector go off
This that sauce, this that dressing
Givenchy, nigga, God bless you
If having a bad bitch was a crime, I'd be arrested(Tru)

[Chorus: Drake]
Got everything, I got everything
I cannot complain, I cannot
I don't even know how much I really made, I forgot, it's a lot
Fuck that, never mind what I got
Nigga don't watch that 'cause I—
Came up, that's all me, stay true, that's all me
No help, that's all me, all me for real
Came up, that's all me, stay true, that's all me
No help, that's all me, all me for real

[Verse 2: Drake]
I touched down in '86, knew I was the man by the age of 6
I even fucked the girl that used to babysit
But that was years later on some crazy shit
I heard your new shit, nigga hated it
Damon Wayans, homie don't play that shit
I get paid a lot, you get paid a bit
And my latest shit is like a greatest hits
God damn, ain't no wishing over on this side
Y'all don't fuck with us, then we don't fuck with y'all
It's no different over on this side
God damn, should I listen to everybody or myself?
'Cause myself just told myself:
""You're the motherfucking man, you don't need no help""
Cashing checks and I’m bigging up my chest
Y'all keep talking ‘bout who next, but I’m about as big as it gets
I swear y'all just wasting y'all breath
I’m the light skinned Keith Sweat, I'ma make it last forever
It’s not your turn 'cause I ain't done yet
Look, just understand that I'm on a roll like Cottonelle
I was made for all of this shit
And I’m on the road box office sales
I’m getting paid for all of this shit
Ask you to please excuse my table manners
I was making room for the table dancers
'Cause if we judging off your advances
Then I just got paid like eight advances, God damn!

[Chorus: Drake]
Got everything, I got everything
I cannot complain, I cannot
I don't even know how much I really made, I forgot, it's a lot
Fuck that, never mind what I got
Nigga don't watch that 'cause I—
Came up, that's all me, stay true, that's all me
No help, that's all me, all me for real
Came up, that's all me, stay true, that's all me—

[Verse 3: Big Sean]
Ho, shut the fuck up!
I got way too much on my mental
I learn from what I've been through
I'm finna do what I didn't do
And still waking up like the rent's due
Not complicated, it's simple
I got sexy ladies, a whole Benz-full
And to them hoes I'm everything—everything but gentle
But I still take my time, man, I guess I'm just old fashioned
Wearing retro shit, that's old fashion
Nigga, see what I'm saying, no closed caption
I paint pics, see the shit, good sex, need to hit
Keep a broad on the floor year 'round like season tickets
I plead the fifth, drink a fifth, load the nine
Leave you split, in the half, smoke a half, need a zip
My new girl is on Glee and shit
Probably making more money than me and shit
I swear to God I got 99 problems but a bitch ain't one
I got 99 problems, getting rich ain't one
Like I got trust issues
I'm sorry for the people I've pushed out
I'm the type to have a bullet-proof condom
And still gotta pull out
But that's just me and I ain't perfect
I ain't a saint but I am worth it
If it's one thing, I am worth it
Niggas still hating but it ain't working
Lil' bitch...

[Verse 4: Drake]
Oh me, oh me, oh my
I think I done fucked too many women from the 305
'Fore the end of this year
I'll do King of Diamonds 3 more times
Smoking on that kush all in our section
Like it's legalized
Girl, you can't always have your way
Sometimes it be like that
They don't really fuck with you like that
They ain't never did me like that
I just took my time, you got the shine
I let you eat like that
I been taught to never loan somebody
What you need right back
And I need that shit right back
(No more free Randy) I’m blessed than a muhfucka
Niggas been stressed than a muhfucka
Niggas getting nervous
Clutching they chests like a muhfucka
Damn that’s a motherfucker
Tell the truth, I don’t listen to you
'Cause I don’t like being lied to
And that ship won’t sail
And that wind won’t guide you
Daddy was in jail, we was talking through the window
Like a motherfucking drive-thru
That was back then, man
Now my niggas rich enough to do whatever I do",Nothing Was the Same,3.8M,"September 24, 2013"
Daft Punk,Get Lucky,"[Verse 1: Pharrell]
Like the legend of the phoenix
All ends with beginnings
What keeps the planet spinning
The force from the beginning

[Pre-Chorus: Pharrell]
We've come too far
To give up who we are
So let's raise the bar
And our cups to the stars

[Chorus: Pharrell]
She's up all night to the sun, I'm up all night to get some
She's up all night for good fun, I'm up all night to get lucky
We're up all night to the sun, we're up all night to get some
We're up all night for good fun, we're up all night to get lucky
We're up all night to get lucky, we're up all night to get lucky
We're up all night to get lucky, we're up all night to get lucky

[Verse 2: Pharrell]
The present has no ribbon
Your gift keeps on giving
What is this I'm feeling?
If you want to leave, I'm with it

[Pre-Chorus: Pharrell]
We've come too far
To give up who we are
So let's raise the bar
And our cups to the stars

[Chorus: Pharrell]
She's up all night to the sun, I'm up all night to get some
She's up all night for good fun, I'm up all night to get lucky
We're up all night to the sun, we're up all night to get some
We're up all night for good fun, we're up all night to get lucky
We're up all night to get lucky, we're up all night to get lucky
We're up all night to get lucky, we're up all night to get lucky

[Bridge: Daft Punk]
We're up all night to get
We're up all night to get
We're up all night to get
We're up all night to get
We're up all night to get
We're up all night to get
We're up all night to get (Lucky)
We're up all night to get
We're up all night to get lucky
We're up all night to get lucky
We're up all night to get lucky
We're up all night to get lucky
We're up all night to get lucky
We're up all night to get lucky
We're up all night to get lucky
We're up all night to get lucky

[Pre-Chorus: Pharrell]
We've come too far
To give up who we are
So let's raise the bar
And our cups to the stars

[Chorus: Pharrell]
She's up all night to the sun, I'm up all night to get some
She's up all night for good fun, I'm up all night to get lucky
We're up all night to the sun, we're up all night to get some
We're up all night for good fun, we're up all night to get lucky
We're up all night to get lucky, we're up all night to get lucky
We're up all night to get lucky, we're up all night to get lucky

[Outro: Pharrell]
We're up all night to get lucky
We're up all night to get lucky
We're up all night to get lucky
We're up all night to get lucky",Random Access Memories,3.8M,"April 19, 2013"
Travis Scott,goosebumps,"[Intro: Travis Scott]
Yeah
7:30 in the night, yeah
Ooh-oooh, ooh

[Chorus: Travis Scott]
I get those goosebumps every time, yeah, you come around, yeah
You ease my mind, you make everything feel fine
Worried 'bout those comments
I'm way too numb, yeah, it's way too dumb, yeah
I get those goosebumps every time, I need the Heimlich
Throw that to the side, yeah
I get those goosebumps every time, yeah
When you're not around (straight up)
When you throw that to the side, yeah (it's lit)
I get those goosebumps every time, yeah

[Verse 1: Travis Scott]
7-1-3
Through the 2-8-1, yeah, I'm ridin', why they on me?
Why they on me? I'm flyin', sippin' low-key
I'm sippin' low-key in Onyx, rider, rider
When I'm pullin' up right beside ya
Pop star, lil' Mariah
When I text a cute game, wildness
Throw a stack on the Bible
Never Snapchat or took molly
She fall through plenty, her and all her ginnies, yeah
We at the top floor, right there off Doheny, yeah
Oh no, I can't fuck with y'all
Yeah, when I'm with my squad I cannot do no wrong
Yeah, saucin' in the city, don't get misinformed
Yeah, they gon' pull up on you (brr, brr, brr)
Yeah, we gon' do some things, some things you can't relate
Yeah, 'cause we from a place, a place you cannot stay
Oh, you can't go, oh, I don't know
Oh, back the fuck up off me (brr, brr, brr)

[Chorus: Travis Scott]
I get those goosebumps every time, yeah, you come around, yeah
You ease my mind, you make everything feel fine
Worried 'bout those comments
I'm way too numb, yeah, it's way too dumb, yeah
I get those goosebumps every time, I need the Heimlich
Throw that to the side, yeah
I get those goosebumps every time, yeah
When you're not around
When you throw that to the side, yeah
I get those goosebumps every time

[Verse 2: Kendrick Lamar]
I want to press my like, yeah, I wanna press my
I want a green light, I wanna be like
I wanna press my line, yeah
I wanna take that ride, yeah
I'm gonna press my line
I want a green light, I wanna be like, I wanna press my—
Mama, dear, spare your feelings
I'm relivin' moments, peeling more residual
(I can) buy the building, burn the building
Take your bitch, rebuild the building just to fuck some more
(I can) justify my love for you
And touch the sky for God to stop, debating war
Put the pussy on a pedestal (ayy)
Put the pussy on a high horse
That pussy to die for
That pussy to die for
Peter, piper, picked a pepper
So I could pick your brain and put your heart together
We depart the shady parts and party hard
The diamonds yours, the coupe forever
My best shots might shoot forever like (brr)

[Chorus: Travis Scott]
I get those goosebumps every time, yeah, you come around, yeah
You ease my mind, you make everything feel fine
Worried 'bout those comments
I'm way too numb, yeah, it's way too dumb, yeah
I get those goosebumps every time, I need the Heimlich
Throw that to the side, yeah
I get those goosebumps every time, yeah
When you're not around
When you throw that to the side, yeah
I get those goosebumps every time",Birds in the Trap Sing McKnight,3.7M,"September 2, 2016"
