Author,Title,Lyrics,Album,Views,Release.Date
Kendrick Lamar,XXX.,"[Intro: Bēkon & Kid Capri]
America, God bless you if it's good to you
America, please take my hand
Can you help me underst—
New Kung Fu Kenny

[Verse 1: Kendrick Lamar]
Throw a steak off the ark
To a pool full of sharks, he'll take it
Leave him in the wilderness
With a sworn nemesis, he'll make it
Take the gratitude from him
I bet he'll show you somethin', whoa
I'll chip a nigga little bit of nothin'
I'll chip a nigga little bit of nothin'
I'll chip a nigga little bit of nothin'
I'll chip a nigga, then throw the blower in his lap
Walk myself to the court like, ""Bitch, I did that!""
X-rated
Johnny don't wanna go to school no mo', no mo'
Johnny said books ain't cool no mo' (no mo')
Johnny wanna be a rapper like his big cousin
Johnny caught a body yesterday out hustlin'
God bless America, you know we all love him

[Verse 2: Kendrick Lamar]
Yesterday I got a call like from my dog like 101
Said they killed his only son because of insufficient funds
He was sobbin', he was mobbin', way belligerent and drunk
Talkin' out his head, philosophin' on what the Lord had done
He said: ""K-Dot, can you pray for me?
It been a fucked up day for me
I know that you anointed, show me how to overcome.""
He was lookin' for some closure
Hopin' I could bring him closer
To the spiritual, my spirit do no better, but I told him
""I can't sugarcoat the answer for you, this is how I feel:
If somebody kill my son, that mean somebody gettin' killed.""
Tell me what you do for love, loyalty, and passion of
All the memories collected, moments you could never touch
I'll wait in front a nigga's spot and watch him hit his block
I'll catch a nigga leavin' service if that's all I got
I'll chip a nigga, then throw the blower in his lap
Walk myself to the court like, ""Bitch, I did that!""
Ain't no Black Power when your baby killed by a coward
I can't even keep the peace, don't you fuck with one of ours
It be murder in the street, it be bodies in the hour
Ghetto bird be on the street, paramedics on the dial
Let somebody touch my momma
Touch my sister, touch my woman
Touch my daddy, touch my niece
Touch my nephew, touch my brother
You should chip a nigga, then throw the blower in his lap
Matter fact, I'm 'bout to speak at this convention
Call you back—

[Break: Kendrick Lamar]
Alright, kids, we're gonna talk about gun control
(Pray for me) Damn!

[Chorus: Bono]
It's not a place
This country is to me a sound
Of drum and bass
You close your eyes to look around

[Verse 3: Kendrick Lamar]
Hail Mary, Jesus and Joseph
The great American flag is wrapped in drag with explosives
Compulsive disorder, sons and daughters
Barricaded blocks and borders
Look what you taught us!
It's murder on my street, your street, back streets
Wall Street, corporate offices
Banks, employees, and bosses with
Homicidal thoughts; Donald Trump's in office
We lost Barack and promised to never doubt him again
But is America honest, or do we bask in sin?
Pass the gin, I mix it with American blood
Then bash him in, you Crippin' or you married to Blood?
I'll ask again—oops, accident
It's nasty when you set us up
Then roll the dice, then bet us up
You overnight the big rifles, then tell Fox to be scared of us
Gang members or terrorists, et cetera, et cetera
America's reflections of me, that's what a mirror does

[Chorus: Bono]
It's not a place
This country is to me a sound
Of drum and bass
You close your eyes to look ar—",DAMN.,4.6M,"April 14, 2017"
Aminé,Caroline,"[Intro]
Listen man
What's up?
I heard you done got you a dime piece, man
Hell naw, man
One of them Beyoncé, Meagan Good types, man
Nah, nah, nah
Is that true, man?
I just wanna know
Probably not
I mean, shit to be honest with you, man, she's a...

[Verse 1]
Bad thang, fine as hell, thick as fuck
Oh my god, that's my baby
Caroline, you divine
Mighty fine
Shawty really blow the pipe (that's true)
Like a pro
Aha, fuck you thought?
Holy shit, I'm really lit
It's looking like it's 'bout time to fuck it up
Caroline, listen up, don't wanna hear
About ya horoscope or what the future holds
Shut up and shut up and
Let's get gory, like a Tarantino movie
Don't wanna talk it out, can we fuck it out?
Cause we gon' be up all night, fuck a decaf
You say I'm a tall thug, guess I'm a G-raffe
If ya want safe-sex, baby use the knee pads
Freaky with the sticky icky
Baby give me kitty kitty
Killa, westside nigga
Boy you like 98 degrees
And I'm 300, nigga keep ya feet runnin'
I chief keef keef when I eat these beats
Better boy get scurred
Don't run up in my lane, I don't want you in my lane
You a lame, get swerved

[Chorus]
Cause great scenes might be great
But I love your bloopers
And perfect's for the urgent
Baby I want forever
Caroline, don't you see that
I want you to be my

[Verse 2]
Bad thang, fine as hell, thick as fuck
Oh my god, that's my baby
Caroline, you divine
Mighty fine
Shawty really blow the pipe (that's true)
Like a pro
Aha... what?
Holy shit, I'm really lit
It's looking like it's 'bout time to fuck it up
Caroline, listen up, don't wanna hear
About ya horoscope or what the future holds
Shut up and shut up and
Let's get gory, like a Tarantino movie
Don't wanna talk it out, can we fuck it out?
Cause we gon' be up all night, fuck a decaf
You say I'm a tall thug, guess I'm a G-raffe
If ya want safe-sex, baby use the knee pads
Freaky with the sticky icky
Baby give me kitty kitty
Killa, westside nigga
Boy you like 98 degrees
And I'm 300, nigga keep ya feet runnin'
I chief keef keef when I eat these beats
Bet a boy get scurred
Don't run up in my lane, I don't want you in my lane
You a lame, get swerved

[Chorus]
Cause great scenes might be great
But I love your bloopers
And perfect's for the urgent
Baby I want forever
Caroline, don't you see that
I want you to be my

[Outro]
Bad thang, bad, bad, bad, bad thang, thang, thang, thang, thang
Bad thang, thang, bad, bad, bad, b-b-bad, thang, thang
Bad thang, thang, thang, bad, b-bad, bad thang, thang, thang
Bad thang, thang, bad, bad, bad, b-b-bad",Good For You,4.6M,"March 9, 2016"
Rae Sremmurd,Black Beatles,"[Intro: Swae Lee & Gucci Mane]
Black Beatles in the city
Be back immediately to confiscate the moneys
(Ear Drummers)
Rae Sremm, Guwop, Mike WiLL!
I sent flowers, but you said you didn't receive 'em
But you said you didn't need 'em (Mike WiLL!)

[Chorus: Swae Lee]
That girl is a real crowd pleaser
Small world, all her friends know of me
Young bull livin' like an old geezer
Quick release the cash, watch it fall slowly
Frat girls still tryna get even
Haters mad for whatever reason
Smoke in the air, binge drinking
They lose it when the DJ drops the needle

[Verse 1: Swae Lee]
Getting so gone I'm not blinkin'
What in the world was I thinkin'?
New day, new money to be made
There is nothin' to explain
I'm a fuckin' black Beatle, cream seats in the Regal
Rockin' John Lennon lenses, like to see ‘em spread eagle
Took a bitch to the club and let her party on the table
Screamin', ""Everybody's famous!""
Like clockwork, I blow it all
And get some more
Get you somebody that can do both
Black Beatles got the babes belly rollin'
She think she love me, I think she trollin'

[Chorus: Swae Lee]
That girl is a real crowd pleaser
Small world, all her friends know of me
Young bull livin' like an old geezer
Quick release the cash, watch it fall slowly
Frat girls still tryna get even
Haters mad for whatever reason
Smoke in the air, binge drinkin'
They lose it when the DJ drops the needle

[Verse 2: Gucci Mane]
Came in with two girls, look like strippers in their real clothes
A broke ho can only point me to a rich ho
A yellow bitch with green hair, a real weirdo
Black man, yellow Lamb', red light go
They seen that Guwop and them just came in through the side door
There's so much money on the floor we buyin' school clothes
Why you bring the money machine to the club for?
Pint of lean, pound of weed, and a kilo
I Eurostep past a hater like I'm Rondo
I upgrade your baby mama to a condo
Like Chapo servin' yayo to the gringos
Black Beatle, club close when I say so

[Chorus: Swae Lee]
That girl is a real crowd pleaser
Small world, all her friends know of me
Young bull livin' like an old geezer
Quick release the cash, watch it fall slowly
Frat girls still tryna get even
Haters mad for whatever reason
Smoke in the air, binge drinkin'
They lose it when the DJ drops the needle

[Verse 3: Slim Jxmmi]
She's a good teaser, and we blowin' reefer
Your body like a work of art, baby
Don't fuck with me, I'll break your heart, baby
D&G on me, I got a lot of flavor
15 hundred on my feet, I'm tryna kill these haters
I had haters when I was broke, I'm rich, I still got haters
I had hoes when I was broke, I'm rich, I'm still a player
I wear leather Gucci jackets like it's still the 80s
I've been blowin' OG Kush, I feel a lil' sedated
I can't worry about a broke nigga or a hater
Black Beatle, bitch, me and Paul McCartney related

[Chorus: Swae Lee]
That girl is a real crowd pleaser
Small world, all her friends know of me
Young bull livin' like an old geezer
Quick release the cash, watch it fall slowly
Frat girls still tryna get even
Haters mad for whatever reason
Smoke in the air, binge drinkin'
They lose it when the DJ drops the needle",SremmLife 2,4.6M,"August 12, 2016"
Original Broadway Cast of Hamilton,Alexander Hamilton,"[AARON BURR]
How does a bastard, orphan, son of a whore and a
Scotsman, dropped in the middle of a forgotten
Spot in the Caribbean by providence, impoverished, in squalor
Grow up to be a hero and a scholar?

[JOHN LAURENS]
The ten-dollar Founding Father without a father
Got a lot farther by working a lot harder
By being a lot smarter
By being a self-starter
By fourteen, they placed him in charge of a trading charter

[THOMAS JEFFERSON]
And every day while slaves were being slaughtered and carted
Away across the waves, he struggled and kept his guard up
Inside, he was longing for something to be a part of
The brother was ready to beg, steal, borrow, or barter

[JAMES MADISON]
Then a hurricane came, and devastation reigned
Our man saw his future drip, dripping down the drain
Put a pencil to his temple, connected it to his brain
And he wrote his first refrain, a testament to his pain

[BURR]
Well, the word got around, they said, “This kid is insane, man”
Took up a collection just to send him to the mainland
“Get your education, don’t forget from whence you came, and
The world's gonna know your name. What’s your name, man?”

[ALEXANDER HAMILTON]
Alexander Hamilton
My name is Alexander Hamilton
And there's a million things I haven't done
But just you wait, just you wait...

[ELIZA HAMILTON]
When he was ten his father split, full of it, debt-ridden
Two years later, see Alex and his mother bed-ridden
Half-dead sittin' in their own sick, the scent thick

[FULL COMPANY EXCEPT HAMILTON (whispering)]
And Alex got better but his mother went quick

[GEORGE WASHINGTON & COMPANY, BOTH]
Moved in with a cousin, the cousin committed suicide
Left him with nothin' but ruined pride, something new inside
A voice saying
“Alex, you gotta fend for yourself.”
He started retreatin' and readin' every treatise on the shelf

[BURR & COMPANY, BOTH]
There would have been nothin’ left to do
For someone less astute
He woulda been dead or destitute
Without a cent of restitution
Started workin', clerkin' for his late mother's landlord
Tradin’ sugar cane and rum and all the things he can’t afford
Scammin' for every book he can get his hands on
Plannin' for the future see him now as he stands on (ooh)
The bow of a ship headed for a new land
In New York you can be a new man

[COMPANY & HAMILTON, WOMEN, MEN]
In New York you can be a new man (Just you wait)
In New York you can be a new man (Just you wait)
In New York you can be a new man
In New York, New York
Just you wait!

[COMPANY]
Alexander Hamilton (Alexander Hamilton)
We are waiting in the wings for you (waiting in the wings for you)
You could never back down
You never learned to take your time!
Oh, Alexander Hamilton (Alexander Hamilton)
When America sings for you
Will they know what you overcame?
Will they know you rewrote the game?
The world will never be the same, oh

[BURR, MEN, & COMPANY]
The ship is in the harbor now
See if you can spot him
Just you wait
Another immigrant
Comin’ up from the bottom
Just you wait
His enemies destroyed his rep
America forgot him

[MULLIGAN/MADISON & LAFAYETTE/JEFFERSON]
We fought with him

[LAURENS/PHILIP]
Me? I died for him

[WASHINGTON]
Me? I trusted him

[ELIZA & ANGELICA & PEGGY/MARIA]
Me? I loved him

[BURR]
And me? I'm the damn fool that shot him

[COMPANY]
There's a million things I haven’t done
But just you wait!

[BURR]
What's your name, man?

[COMPANY]
Alexander Hamilton!",Hamilton (Original Broadway Cast Recording),4.5M,"September 25, 2015"
Kendrick Lamar,Money Trees,"[Produced by DJ Dahi]

[Verse 1: Kendrick Lamar]
Uh, me and my niggas tryna get it, ya bish (ya bish)
Hit the house lick: tell me, is you wit' it, ya bish? (ya bish)
Home invasion was persuasive (was persuasive)
From nine to five I know it's vacant, ya bish (ya bish)
Dreams of livin' life like rappers do (like rappers do)
Back when condom wrappers wasn't cool (they wasn't cool)
I fucked Sherane and went to tell my bros (tell my bros)
Then Usher Raymond ""Let It Burn"" came on (""Let Burn"" came on)
Hot sauce all in our Top Ramen, ya bish (ya bish)
Park the car, then we start rhymin', ya bish (ya bish)
The only thing we had to free our mind (free our mind)
Then freeze that verse when we see dollar signs (see dollar signs)
You lookin' like a easy come-up, ya bish (ya bish)
A silver spoon I know you come from, ya bish (ya bish)
And that's a lifestyle that we never knew (we never knew)
Go at a reverend for the revenue

[Hook: Kendrick Lamar]
It go Halle Berry or hallelujah
Pick your poison, tell me what you doin'
Everybody gon' respect the shooter
But the one in front of the gun lives forever
(The one in front of the gun, forever)
And I been hustlin' all day
This-a-way, that-a-way
Through canals and alleyways, just to say
Money trees is the perfect place for shade
And that's just how I feel, nah, nah
A dollar might just fuck your main bitch
That's just how I feel, nah
A dollar might say fuck them niggas that you came with
That's just how I feel, nah, nah
A dollar might just make that lane switch
That's just how I feel, nah
A dollar might turn to a million and we all rich
That's just how I feel

[Verse 2: Kendrick Lamar]
Dreams of livin' life like rappers do (like rappers do)
Bump that new E-40 after school (way after school)
You know, “Big Ballin' With My Homies” (my homies)
Earl Stevens had us thinkin' rational (thinkin' rational)
Back to reality, we poor, ya bish (ya bish)
Another casualty at war, ya bish (ya bish)
Two bullets in my Uncle Tony head (my Tony head)
He said one day I'll be on tour, ya bish (ya bish)
That Louis Burgers never be the same (won't be the same)
A Louis belt will never ease that pain (won't ease that pain)
But I'ma purchase when that day is jerkin' (that day is jerkin')
Pull off at Church's, with Pirellis skirtin' (Pirellis skirtin')
Gang signs out the window, ya bish (ya bish)
Hopin' all of 'em offend you, ya bish (ya bish)
They say your hood is a pot of gold (a pot of gold)
And we gon' crash it when nobody's home

[Hook: Kendrick Lamar]
It go Halle Berry or hallelujah
Pick your poison, tell me what you doin'
Everybody gon' respect the shooter
But the one in front of the gun lives forever
(The one in front of the gun, forever)
And I been hustlin' all day
This-a-way, that-a-way
Through canals and alleyways, just to say
Money trees is the perfect place for shade
And that's just how I feel, nah, nah
A dollar might just fuck your main bitch
That's just how I feel, nah
A dollar might say fuck them niggas that you came with
That's just how I feel, nah, nah
A dollar might just make that lane switch
That's just how I feel, nah
A dollar might turn to a million and we all rich
That's just how I feel

[Bridge: Anna Wise]
Be the last one out to get this dough? No way!
Love one of you bucket-headed hoes? No way!
Hit the streets, then we break the code? No way!
Hit the brakes when they on patrol? No way!
Be the last one out to get this dough? No way!
Love one of you bucket-headed hoes? No way!
Hit the streets, then we break the code? No way!
Hit the brakes when they on patrol? No way!

[Verse 3: Jay Rock]
Imagine Rock up in them projects
Where them niggas pick your pockets
Santa Claus don't miss them stockings
Liquors spillin', pistols poppin'
Bakin' soda YOLA whippin'
Ain't no turkey on Thanksgivin'
My homeboy just dome'd a nigga
I just hope the Lord forgive him
Pots with cocaine residue
Every day I'm hustlin'
What else is a thug to do
When you eatin' cheese from the government?
Gotta provide for my daughter n'em
Get the fuck up out my way, bish
Got that drum and I got them bands
Just like a parade, bish
Drop that work up in the bushes
Hope them boys don't see my stash
If they do, tell the truth
This the last time you might see my ass
From the gardens where the grass ain't cut
Them serpents lurkin', Blood
Bitches sellin' pussy, niggas sellin' drugs
But it's all good
Broken promises, steal your watch
And tell you what time it is
Take your J's and tell you to kick it where a FootLocker is
In the streets with a heater under my Dungarees
Dreams of me gettin' shaded under a money tree

[Hook: Kendrick Lamar]
It go Halle Berry or hallelujah
Pick your poison, tell me what you doin'
Everybody gon' respect the shooter
But the one in front of the gun lives forever
(The one in front of the gun, forever)
And I been hustlin' all day
This-a-way, that-a-way
Through canals and alleyways, just to say
Money trees is the perfect place for shade
And that's just how I feel

[Outro]
K’s Mom: Kendrick, just bring my car back, man. I called in for another appointment. I figured you weren’t gonna be back here on time anyways. Look, shit, shit, I just wanna get out the house, man. This man is on one, he feelin' good as a motherfucker. Shit, I’m tryna get my thing goin', too. Just bring my car back. Shit, he faded. He feelin' good. Look, listen to him!
K’s Dad: Girl, girl, I want your body, I want your body, 'cause of that big ol’ fat ass. Girl, girl, I want your body, I want your body, 'cause of that big ol’ fat ass
K’s Mom: See, he high as hell. Shit, and he ain’t even trippin' off them damn dominoes anymore. Just bring the car back!
K’s Dad: Did somebody say dominoes?","good kid, m.A.A.d city (Deluxe Version)",4.5M,"October 22, 2012"
Adele,Hello,"[Verse 1]
Hello, it's me
I was wondering if after all these years you'd like to meet
To go over everything
They say that time's supposed to heal ya, but I ain't done much healing
Hello, can you hear me?
I'm in California dreaming about who we used to be
When we were younger and free
I've forgotten how it felt before the world fell at our feet

[Pre-Chorus 1]
There's such a difference between us
And a million miles

[Chorus]
Hello from the other side
I must've called a thousand times
To tell you, I'm sorry for everything that I've done
But when I call, you never seem to be home
Hello from the outside
At least, I can say that I've tried
To tell you, I'm sorry for breaking your heart
But it don't matter, it clearly doesn't tear you apart anymore

[Verse 2]
Hello, how are you?
It's so typical of me to talk about myself, I'm sorry
I hope that you're well
Did you ever make it out of that town where nothing ever happened?

[Pre-Chorus 2]
It's no secret that the both of us
Are running out of time

[Chorus]
So hello from the other side
I must've called a thousand times
To tell you, I'm sorry for everything that I've done
But when I call, you never seem to be home
Hello from the outside
At least, I can say that I've tried
To tell you, I'm sorry for breaking your heart
But it don't matter, it clearly doesn't tear you apart anymore

[Bridge]
(Highs, highs, highs, highs, lows, lows, lows, lows)
Ooh, anymore
(Highs, highs, highs, highs, lows, lows, lows, lows)
Ooh, anymore
(Highs, highs, highs, highs, lows, lows, lows, lows)
Ooh, anymore
(Highs, highs, highs, highs, lows, lows, lows, lows)
Anymore

[Chorus]
Hello from the other side
I must've called a thousand times
To tell you, I'm sorry for everything that I've done
But when I call, you never seem to be home
Hello from the outside
At least, I can say that I've tried
To tell you, I'm sorry for breaking your heart
But it don't matter, it clearly doesn't tear you apart anymore

[Produced by Greg Kurstin]
[Music Video]",25,4.4M,"October 23, 2015"
Kendrick Lamar,"Bitch, Don’t Kill My Vibe","[Produced by Sounwave]

[Chorus]
I am a sinner who's probably gonna sin again
Lord, forgive me! Lord, forgive me!
Things I don't understand
Sometimes I need to be alone
Bitch, don't kill my vibe!
Bitch, don't kill my vibe!
I can feel your energy from two planets away
I got my drink, I got my music
I would share it, but today I'm yelling
Bitch, don't kill my vibe! Bitch, don't kill my vibe!
Bitch, don't kill my vibe! Bitch, don't kill my vibe!

[Verse 1]
Look inside of my soul and you can find gold and maybe get rich
Look inside of your soul and you can find out it never exist
I can feel the changes
I can feel a new life, I always knew life can be dangerous
I can say that I like a challenge and you tell me it's painless
You don't know what pain is
How can I paint this picture
When the color blind is hangin' with you?
Fell on my face and awoke with a scar
Another mistake livin' deep in my heart
Wear it on top of my sleeve in a flick
I can admit that it did look like yours
Why you resent every making of this?
Tell me your purpose is petty again
But even a small lighter can burn a bridge
Even a small lighter can burn a bridge

[Bridge]
I can feel the changes
I can feel the new people around me just want to be famous
You can see that my city found me
Then put me on stages, to me that's amazin'
To you that's a quick check
With all disrespect, let me say this

[Chorus]
I am a sinner who's probably gonna sin again
Lord, forgive me! Lord, forgive me!
Things I don't understand
Sometimes I need to be alone
Bitch, don't kill my vibe! Bitch, don't kill my vibe!
I can feel your energy from two planets away
I got my drink, I got my music
I would share it, but today I'm yelling
Bitch, don't kill my vibe! Bitch, don't kill my vibe!
Bitch, don't kill my vibe! Bitch, don't kill my vibe!

[Verse 2]
I'm tryin' to keep it alive
And not compromise the feeling we love
You're tryin' to keep it deprived
And only co-sign what radio does
And I'm lookin' right past you
We live in a world, we live in a world on two different axles
You live in a world, you livin' behind the mirror
I know what you scared of
The feeling of feeling emotions inferior
This shit is vital, I know you had to
This shit is vital, I know you had to
Die in a pitiful vain, tell me a watch and a chain
Is way more believable, give me a feasible gain
Rather a seasonal name
I'll let the people know this is somethin' you can blame
On yourselves, you can remain stuck in a box
I'ma break out and then hide every lock
I'ma break out and then hide every lock

[Bridge]
I can feel the changes
I can feel the new people around me just want to be famous
You can see that my city found me
Then put me on stages, to me that's amazin'
To you that's a quick check
With all disrespect, let me say this

[Chorus]
I am a sinner who's probably gonna sin again
Lord, forgive me! Lord, forgive me!
Things I don't understand
Sometimes I need to be alone
Bitch, don't kill my vibe! Bitch, don't kill my vibe!
I can feel your energy from two planets away
I got my drink, I got my music
I would share it, but today I'm yelling
Bitch, don't kill my vibe! Bitch, don't kill my vibe!
Bitch, don't kill my vibe! Bitch, don't kill my vibe!

[Outro]
Bitch, don't kill my vibe!
You ain't heard the Coast like this in a long time
Don't you see that long line?
And they waiting on Kendrick like the first and the fifteenth
Threes in the air, I can see you are in sync
Hide your feelings, hide your feelings
Now what you better do
I'll take your girlfriend and put that pussy on a pedestal
Bitch, don't kill my vibe! Bitch, don't kill my vibe!
Walk out the door and they scream it's alive
My New Year's resolution is to stop all the pollution
Talk too motherfuckin' much, I got my drink, I got my music
I say bitch, don't kill my vibe! Bitch, don't kill my vibe!
Bitch, don't kill my vibe! Bitch, don't kill my vibe!

[Death to Molly]

[Outro]
Ayy, K-Dot, get in the car, nigga!
Come on, we finna roll out!
Nigga, I got a pack of blacks and a beat CD
Get yo' freestyles ready!","good kid, m.A.A.d city (Deluxe Version)",4.4M,"October 22, 2012"
