Author,Title,Lyrics,Album,Views,Release.Date
Luis Fonsi & Daddy Yankee,Despacito (Remix),"[Letra de ""Despacito (Remix)"" ft. Justin Bieber]

[Intro: Justin Bieber]
Comin' over in my direction
So thankful for that, it's such a blessin', yeah
Turn every situation into heaven, yeah
Oh-oh, you are
My sunrise on the darkest day
Got me feelin' some kind of way
Make me wanna savor every moment slowly, slowly
You fit me tailor-made, love how you put it on
Got the only key, know how to turn it on
The way you nibble on my ear, the only words I wanna hear
Baby, take it slow so we can last long

[Verso 1: Luis Fonsi & Daddy Yankee]
¡Oh! Tú, tú eres el imán y yo soy el metal
Me voy acercando y voy armando el plan
Sólo con pensarlo se acelera el pulso (Oh, yeah)
Ya, ya me está gustando más de lo normal
Todos mis sentidos van pidiendo más
Esto hay que tomarlo sin ningún apuro

[Coro: Justin Bieber & Luis Fonsi / Daddy Yankee]
Despacito
Quiero respirar tu cuello despacito
Deja que te diga cosas al oído
Para que te acuerdes si no estás conmigo
Despacito
Quiero desnudarte a besos despacito
Firmo en las paredes de tu laberinto
Y hacer de tu cuerpo todo un manuscrito
(Sube, sube, sube
Sube, sube)

[Post-Coro: Luis Fonsi & Daddy Yankee]
Quiero ver bailar tu pelo, quiero ser tu ritmo (Woah, woah)
Que le enseñes a mi boca (Woah, woah)
Tus lugares favoritos (Favorito, favorito, baby)
Déjame sobrepasar tus zonas de peligro (Woah, woah)
Hasta provocar tus gritos (Woah, woah)
Y que olvides tu apellido

[Verso 2: Daddy Yankee]
Si te pido un beso, ven, dámelo, yo sé que estás pensándolo
Llevo tiempo intentándolo, mami, esto es dando y dándolo
Sabes que tu corazón conmigo te hace bom, bom
Sabes que esa beba está buscando de mi bom, bom
Ven, prueba de mi boca para ver cómo te sabe
Quiero, quiero, quiero ver cuánto amor a ti te cabe
Yo no tengo prisa, yo me quiero dar el viaje
Empecemos lento, después salvaje

[Pre-Coro: Daddy Yankee & Justin Bieber / Daddy Yankee]
Pasito a pasito, suave suavecito
Nos vamos pegando, poquito a poquito
Cuando tú me besas con esa destreza
Veo que eres malicia con delicadeza
Pasito a pasito, suave suavecito
Nos vamos pegando, poquito a poquito
Y es que esa belleza es un rompecabezas
Pero pa' montarlo aquí tengo la pieza
¡Oye!

[Coro: Justin Bieber & Luis Fonsi / Daddy Yankee]
Despacito
Quiero respirar tu cuello despacito
Deja que te diga cosas al oído
Para que te acuerdes si no estás conmigo
Despacito
Quiero desnudarte a besos despacito
Firmo en las paredes de tu laberinto
Y hacer de tu cuerpo todo un manuscrito
(Sube, sube, sube
Sube, sube)

[Post-Coro: Luis Fonsi & Daddy Yankee]
Quiero ver bailar tu pelo, quiero ser tu ritmo (Woah, woah)
Que le enseñes a mi boca (Woah, woah)
Tus lugares favoritos (Favorito, favorito, baby)
Déjame sobrepasar tus zonas de peligro (Woah, woah)
Hasta provocar tus gritos (Woah, woah)
Y que olvides tu apellido

[Puente: Luis Fonsi]
Despacito
This is how we do it down in Puerto Rico
I just wanna hear you screaming, ""¡Ay, Bendito!""
I can move forever cuando esté contigo
¡Báilalo!

[Post-Coro: Daddy Yankee, Luis Fonsi & Justin Bieber]
Pasito a pasito, suave suavecito
Nos vamos pegando, poquito a poquito
Que le enseñes a mi boca
Tus lugares favoritos
(Favorito, favorito, baby)
Pasito a pasito, suave suavecito
Nos vamos pegando, poquito a poquito
Hasta provocar tus gritos (Fonsi)
Y que olvides tu apellido (D.Y.)
Despacito",Now That’s What I Call Music! 97 [UK],22.7M,"April 17, 2017"
Eminem,Rap God,"[Intro]
""Look, I was gonna go easy on you not to hurt your feelings.""
""But I'm only going to get this one chance.""
""Something's wrong, I can feel it.""
Six minutes. Six minutes. Six minutes, Slim Shady, you're on!
""Just a feeling I've got. Like something's about to happen, but I don't know what. If that means what I think it means, we're in trouble, big trouble; and if he is as bananas as you say, I'm not taking any chances.""
""You are just what the doc ordered.""

[Chorus]
I'm beginnin' to feel like a Rap God, Rap God
All my people from the front to the back nod, back nod
Now, who thinks their arms are long enough to slap box, slap box?
They said I rap like a robot, so call me Rap-bot

[Verse 1]
But for me to rap like a computer it must be in my genes
I got a laptop in my back pocket
My pen'll go off when I half-cock it
Got a fat knot from that rap profit
Made a livin' and a killin' off it
Ever since Bill Clinton was still in office
With Monica Lewinsky feelin' on his nutsack
I'm an MC still as honest
But as rude and as indecent as all hell
Syllables, skill-a-holic (Kill 'em all with)
This flippity dippity-hippity hip-hop
You don't really wanna get into a pissin' match
With this rappity brat, packin' a MAC in the back of the Ac'
Backpack rap crap, yap-yap, yackety-yack
And at the exact same time, I attempt these lyrical acrobat stunts while I'm practicin' that
I'll still be able to break a motherfuckin' table
Over the back of a couple of faggots and crack it in half
Only realized it was ironic, I was signed to Aftermath after the fact
How could I not blow? All I do is drop F-bombs
Feel my wrath of attack
Rappers are havin' a rough time period, here's a maxi pad
It's actually disastrously bad for the wack
While I'm masterfully constructing this masterpiece as

[Chorus]
'Cause I'm beginnin' to feel like a Rap God, Rap God
All my people from the front to the back nod, back nod
Now, who thinks their arms are long enough to slap box, slap box?
Let me show you maintainin' this shit ain't that hard, that hard

[Verse 2]
Everybody wants the key and the secret to rap immortality like Ι have got. Well, to be truthful the blueprint's
Simply rage and youthful exuberance
Everybody loves to root for a nuisance
Hit the Earth like an asteroid
Did nothing but shoot for the Moon since (Pew!)
MCs get taken to school with this music
'Cause I use it as a vehicle to ""bus the rhyme""
Now I lead a new school full of students
Me? I'm a product of Rakim
Lakim Shabazz, 2Pac, N.W.A, Cube, hey Doc, Ren
Yella, Eazy, thank you, they got Slim
Inspired enough to one day grow up, blow up and be in a position
To meet Run–D.M.C., induct them
Into the motherfuckin' Rock and Roll Hall of Fame
Even though I'll walk in the church and burst in a ball of flames
Only Hall of Fame I'll be inducted in is the alcohol of fame
On the wall of shame
You fags think it's all a game, 'til I walk a flock of flames
Off a plank and, tell me what in the fuck are you thinkin'?
Little gay-lookin' boy
So gay I can barely say it with a straight face, lookin' boy
You're witnessin' a massacre
Like you're watching a church gathering take place, lookin' boy
""Oy vey, that boy's gay!""—that's all they say, lookin' boy
You get a thumbs up, pat on the back
And a ""way to go"" from your label every day, lookin' boy
Hey, lookin' boy! What you say, lookin' boy?
I get a ""hell yeah"" from Dre, lookin' boy
I'ma work for everything I have, never ask nobody for shit
Get outta my face, lookin' boy!
Basically, boy, you're never gonna be capable
Of keepin' up with the same pace, lookin' boy, 'cause—

[Chorus]
I'm beginnin' to feel like a Rap God, Rap God
All my people from the front to the back nod, back nod
The way I'm racin' around the track, call me NASCAR, NASCAR
Dale Earnhardt of the trailer park, the White Trash God
Kneel before General Zod
This planet's Krypton—no, Asgard, Asgard

[Verse 3]
So you'll be Thor and I'll be Odin
You rodent, I'm omnipotent
Let off, then I'm reloadin'
Immediately with these bombs, I'm totin'
And I should not be woken
I'm the walkin' dead, but I'm just a talkin' head, a zombie floatin'
But I got your mom deep-throatin'
I'm out my Ramen Noodle
We have nothin' in common, poodle
I'm a Doberman, pinch yourself in the arm and pay homage, pupil
It's me, my honesty's brutal
But it's honestly futile if I don't utilize what I do though
For good at least once in a while
So I wanna make sure somewhere in this chicken scratch I scribble and doodle enough rhymes
To maybe try to help get some people through tough times
But I gotta keep a few punchlines
Just in case, 'cause even you unsigned
Rappers are hungry lookin' at me like it's lunchtime
I know there was a time where once I
Was king of the underground
But I still rap like I'm on my Pharoahe Monch grind
So I crunch rhymes, but sometimes when you combine
Appeal with the skin color of mine
You get too big and here they come tryin'
To censor you like that one line
I said on ""I'm Back"" from The Mathers LP 1 when I
Tried to say I'll take seven kids from Columbine
Put 'em all in a line, add an AK-47, a revolver and a 9
See if I get away with it now that I ain't as big as I was, but I'm
Morphin' into an immortal, comin' through the portal
You're stuck in a time warp from 2004 though
And I don't know what the fuck that you rhyme for
You're pointless as Rapunzel with fuckin' cornrows
You write normal? Fuck being normal!
And I just bought a new raygun from the future
Just to come and shoot ya, like when Fabolous made Ray J mad
'Cause Fab said he looked like a fag at Mayweather's pad
Singin' to a man while he played piano
Man, oh man, that was a 24/7 special on the cable channel
So Ray J went straight to the radio station
The very next day, ""Hey Fab, I'ma kill you!""
Lyrics comin' at you at supersonic speed (J.J. Fad)
Uh, summa-lumma, dooma-lumma, you assumin' I'm a human
What I gotta do to get it through to you I'm superhuman?
Innovative and I'm made of rubber so that anything you say is ricochetin' off of me and it'll glue to you and
I'm devastating, more than ever demonstrating
How to give a motherfuckin' audience a feeling like it's levitating
Never fading, and I know the haters are forever waiting
For the day that they can say I fell off, they'll be celebrating
'Cause I know the way to get 'em motivated
I make elevating music, you make elevator music
""Oh, he's too mainstream.""
Well, that's what they do when they get jealous, they confuse it
""It's not hip-hop, it's pop,""—'cause I found a hella way to fuse it
With rock, shock rap with Doc
Throw on ""Lose Yourself"" and make 'em lose it
""I don't know how to make songs like that
I don't know what words to use.""
Let me know when it occurs to you
While I'm rippin' any one of these verses that versus you
It's curtains, I'm inadvertently hurtin' you
How many verses I gotta murder to
Prove that if you were half as nice
Your songs you could sacrifice virgins too?
Ugh, school flunky, pill junkie
But look at the accolades these skills brung me
Full of myself, but still hungry
I bully myself 'cause I make me do what I put my mind to
And I'm a million leagues above you
Ill when I speak in tongues, but it's still tongue-in-cheek, fuck you!
I'm drunk, so, Satan, take the fucking wheel
I'ma sleep in the front seat
Bumpin' Heavy D and the Boyz, still ""Chunky but Funky""
But in my head there's something I can feel tugging and struggling
Angels fight with devils, and here's what they want from me
They're askin' me to eliminate some of the women hate
But if you take into consideration the bitter hatred
I have, then you may be a little patient
And more sympathetic to the situation
And understand the discrimination
But fuck it, life's handin' you lemons? Make lemonade then!
But if I can't batter the women
How the fuck am I supposed to bake them a cake then?
Don't mistake him for Satan; it's a fatal mistake
If you think I need to be overseas and take a vacation
To trip a broad, and make her fall on her face and
Don't be a retard! Be a king? Think not
Why be a king when you can be a God?",The Marshall Mathers LP2,14.5M,"October 15, 2013"
Ed Sheeran,Shape of You,"[Verse 1]
The club isn't the best place to find a lover
So the bar is where I go
Me and my friends at the table doing shots
Drinking fast and then we talk slow
And you come over and start up a conversation with just me
And trust me I'll give it a chance now
Take my hand, stop, put Van the Man on the jukebox
And then we start to dance, and now I'm singing like

[Pre-Chorus]
Girl, you know I want your love
Your love was handmade for somebody like me
Come on now, follow my lead
I may be crazy, don't mind me
Say, boy, let's not talk too much
Grab on my waist and put that body on me
Come on now, follow my lead
Come, come on now, follow my lead

[Chorus]
I'm in love with the shape of you
We push and pull like a magnet do
Although my heart is falling too
I'm in love with your body
And last night you were in my room
And now my bed sheets smell like you
Every day discovering something brand new
I'm in love with your body
Oh—I—oh—I—oh—I—oh—I
I'm in love with your body
Oh—I—oh—I—oh—I—oh—I
I'm in love with your body
Oh—I—oh—I—oh—I—oh—I
I'm in love with your body
Every day discovering something brand new
I'm in love with the shape of you

[Verse 2]
One week in we let the story begin
We're going out on our first date
You and me are thrifty, so go all you can eat
Fill up your bag and I fill up a plate
We talk for hours and hours about the sweet and the sour
And how your family is doing okay
Leave and get in a taxi, then kiss in the backseat
Tell the driver make the radio play, and I'm singing like

[Pre-Chorus]
Girl, you know I want your love
Your love was handmade for somebody like me
Come on now, follow my lead
I may be crazy, don't mind me
Say, boy, let's not talk too much
Grab on my waist and put that body on me
Come on now, follow my lead
Come, come on now, follow my lead

[Chorus]
I'm in love with the shape of you
We push and pull like a magnet do
Although my heart is falling too
I'm in love with your body
And last night you were in my room
And now my bed sheets smell like you
Every day discovering something brand new
I'm in love with your body
Oh—I—oh—I—oh—I—oh—I
I'm in love with your body
Oh—I—oh—I—oh—I—oh—I
I'm in love with your body
Oh—I—oh—I—oh—I—oh—I
I'm in love with your body
Every day discovering something brand new
I'm in love with the shape of you

[Bridge]
Come on, be my baby, come on
Come on, be my baby, come on
Come on, be my baby, come on
Come on, be my baby, come on
Come on, be my baby, come on
Come on, be my baby, come on
Come on, be my baby, come on
Come on, be my baby, come on

[Chorus]
I'm in love with the shape of you
We push and pull like a magnet do
Although my heart is falling too
I'm in love with your body
Last night you were in my room
And now my bed sheets smell like you
Every day discovering something brand new
I'm in love with your body
Come on, be my baby, come on
Come on, be my baby, come on
I'm in love with your body
Come on, be my baby, come on
Come on, be my baby, come on
I'm in love with your body
Come on, be my baby, come on
Come on, be my baby, come on
I'm in love with your body
Every day discovering something brand new
I'm in love with the shape of you",÷ (Divide),13.8M,"January 6, 2017"
Kendrick Lamar,HUMBLE.,"[Intro]
Nobody pray for me
It's been that day for me
Waaaaay (Yeah, yeah!)

[Verse 1]
Ayy, I remember syrup sandwiches and crime allowances
Finesse a nigga with some counterfeits, but now I’m countin' this
Parmesan where my accountant lives, in fact I'm downin’ this
D'USSÉ with my boo bae tastes like Kool-Aid for the analysts
Girl, I can buy yo' ass the world with my paystub
Ooh, that pussy good, won't you sit it on my taste bloods?
I get way too petty once you let me do the extras
Pull up on your block, then break it down: we playin' Tetris
A.M. to the P.M., P.M. to the A.M., funk
Piss out your per diem, you just gotta hate 'em, funk
If I quit your BM, I still ride Mercedes, funk
If I quit this season, I still be the greatest, funk
My left stroke just went viral
Right stroke put lil' baby in a spiral
Soprano C, we like to keep it on a high note
It's levels to it, you and I know

[Chorus]
Bitch, be humble (Hol’ up, bitch)
Sit down (Hol’ up, lil', hol’ up, lil' bitch)
Be humble (Hol' up, bitch)
Sit down (Hol' up, sit down, lil’, sit down, lil' bitch)
Be humble (Hol' up, hol' up)
Bitch, sit down (Hol' up, hol' up, lil' bitch)
Be humble (Lil' bitch, hol' up, bitch)
Sit down (Hol' up, hol' up, hol' up, hol' up)
Be humble (Hol' up, hol' up)
Sit down (Hol' up, hol' up, lil', hol' up, lil' bitch)
Be humble (Hol' up, bitch)
Sit down (Hol' up, sit down, lil', sit down, lil' bitch)
Be humble (Hol' up, hol' up)
Bitch, sit down (Hol' up, hol' up, lil' bitch)
Be humble (Lil' bitch, hol' up, bitch)
Sit down (Hol' up, hol' up, hol' up, hol' up)

[Verse 2]
Who dat nigga thinkin' that he frontin' on Man-Man? (Man-Man)
Get the fuck off my stage, I'm the Sandman (Sandman)
Get the fuck off my dick, that ain't right
I make a play fucking up your whole life
I'm so fuckin' sick and tired of the Photoshop
Show me somethin' natural like afro on Richard Pryor
Show me somethin' natural like ass with some stretch marks
Still will take you down right on your mama's couch in Polo socks
Ayy, this shit way too crazy, ayy, you do not amaze me, ayy
I blew cool from AC, ayy, Obama just paged me, ayy
I don't fabricate it, ayy, most of y'all be fakin', ayy
I stay modest 'bout it, ayy, she elaborate it, ayy
This that Grey Poupon, that Evian, that TED Talk, ayy
Watch my soul speak, you let the meds talk, ayy
If I kill a nigga, it won't be the alcohol, ayy
I'm the realest nigga after all

[Chorus]
Bitch, be humble (Hol' up, bitch)
Sit down (Hol' up, lil', hol' up, lil' bitch)
Be humble (Hol' up, bitch)
Sit down (Hol' up, sit down, lil', sit down, lil' bitch)
Be humble (Hol' up, hol' up)
Bitch, sit down (Hol' up, hol' up, lil' bitch)
Be humble (Lil' bitch, hol' up, bitch)
Sit down (Hol' up, hol' up, hol' up, hol' up)
Be humble (Hol' up, hol' up)
Sit down (Hol' up, hol' up, lil', hol' up, lil' bitch)
Be humble (Hol' up, bitch)
Sit down (Hol' up, sit down, lil', sit down, lil' bitch)
Be humble (Hol' up, hol' up)
Bitch, sit down (Hol' up, hol' up, lil' bitch)
Be humble (Lil' bitch, hol' up, bitch)
Sit down (Hol' up, hol' up, hol' up, hol' up)",DAMN.,10.1M,"March 30, 2017"
Big Shaq,Man’s Not Hot,"[Intro]
Yo, Big Shaq, the one and only
Man's not hot, never hot
Skrrat (GottiOnEm), skidi-kat-kat
Boom

[Verse 1]
Two plus two is four
Minus one that's three, quick maths
Everyday man's on the block
Smoke trees (Ah)
See your girl in the park
That girl is a uckers
When the ting went quack-quack-quack
You man were ducking (You man ducked)
Hold tight, Asznee (My brudda)
He's got the pumpy (Big ting)
Hold tight, my man (My guy)
He's got the frisbee (Shew)
I trap, trap, trap on the phone
Movin' that cornflakes (Uh)
Rice Krispies
Hold tight, my girl Whitney (My G)
On, on, on, on, on the road doin' 10 toes
Like my toes (Like my toes)
You man thought I froze
I see a peng girl, then I pose (Chilin')
If she ain't on it, I ghost
Hah, look at your nose (Check your nose, fam)
You donut
Nose long like garden hose

[Chorus]
I tell her man's not hot
I tell her man's not hot
The girl told me, ""Take off your jacket""
I said, ""Babes, man's not hot"" (Never hot)
I tell her man's not hot (Never hot)
I tell her man's not hot (Never hot)
The girl told me, ""Take off your jacket""
I said, ""Babes, man's not hot"" (Never hot)

[Verse 2]
Hop out the four-door with the .44
It was one, two, three and four (Us, man)
Chillin' in the corridor (Yo)
Your dad is forty-four (Uh)
And he's still callin' man for a draw (Look at him)
Let him know
When I see him
I'm gonna spin his jaw (Finished)
Take man's Twix by force (Take it)
Send man's shop by force (Send him)
Your girl knows I've got the sauce (Flexin')
No ketchup (None)
Just sauce (Saucy)
Raw sauce
(Ah) Yo, boom, ah

[Refrain]
The ting goes skrrrahh (Ah)
Pap, pap, ka-ka-ka (Ka-ka)
Skidiki-pap-pap (Pap)
And a pu-pu-pudrrrr-boom (Boom)
Skya (Ah)
Du-du-ku-ku-dun-dun (Dun)
Poom, poom
You dun know

[Chorus]
I tell her man's not hot (Man's not)
I tell her man's not hot (Never hot)
The girl told me, ""Take off your jacket""
I said, ""Babes, man's not hot"" (Never hot)
I tell her man's not hot
I tell her man's not hot (Never hot)
The girl told me, ""Take off your jacket""
I said, ""Babes, man's not hot""

[Bridge]
Man can never be hot (Never hot)
Perspiration ting (Spray dat)
Lynx Effect (Come on)
You didn't hear me, did you? (Nah)
Use roll-on (Use that)
Or spray (Shhh)
But either way, A-B-C-D (Alphabet ting)

[Refrain]
The ting goes skrrrahh (Ah)
Pap, pap, ka-ka-ka (Ka)
Skidiki-pap-pap (Pap)
And a pu-pu-pudrrrr-boom (Boom)
Skya (Ah)
Du-du-ku-ku-dun-dun (Dun)
Poom, poom
You dun know

[Outro]
Big Shaq
Man's not hot
I tell her man's not hot (Never hot)
40 degrees and man's not hot (Come on)
Yo (Ah), in the sauna
Man's not hot (Never hot)
Yeah, skidika-pap-pap",NA,8.3M,"September 22, 2017"
