Author,Title,Lyrics,Album,Views,Release.Date
JAY-Z,Holy Grail,"[Intro: Justin Timberlake]
You'd take the clothes off my back and I'd let you
You'd steal the food right out my mouth
And I'd watch you eat it
I still don’t know why, why our love is so much, ohh
(Thanks for warnin' me, thanks for warnin' me)
You curse my name in spite to put me to shame
Hang my laundry in the streets, dirty or clean
Give it up for fame
But I still don't know why, why I love it so much
(Thanks for warnin' me, thanks for warnin' me)

[Chorus: Justin Timberlake]
And, baby, it's amazin' I'm in this maze with you
I just can't crack your code
One day you screamin' you love me loud
The next day you're so cold
One day you're here, one day you're there, one day you care
You're so unfair
Sippin' from your cup 'til it runneth over
Holy Grail

[Verse 1: Jay Z]
Uh, uh, uh
Blue told me remind you niggas, uh
Fuck that shit y'all talking 'bout, I'm the nigga, uh
Caught up in all these lights and cameras, uh
But look what that shit did to Hammer, uh
Goddamn it, I like it
Bright lights is enticin', but look what it did to Tyson
All that money in one night, thirty mil' for one fight
But soon as all the money blows, all the pigeons take flight
Fuck the fame, keep cheatin' on me
What I do? I took her back
Fool me twice; that's my bad, I can't even blame her for that
Enough to make me wanna murder
Momma, please just get my bail
I know nobody to blame; Kurt Cobain, I did it to myself, uh

[Bridge: Justin Timberlake & Jay Z]
And we all just entertainers
And we're stupid and contagious
And we all just entertainers

[Chorus: Justin Timberlake]
And, baby, it's amazin' I'm in this maze with you
I just can't crack your code
One day you screamin' you love me loud
The next day you're so cold
One day you're here, one day you're there, one day you care
You're so unfair
Sippin' from your cup 'til it runneth over
Holy Grail

[Verse 2: Jay Z]
Now I got tattoos on my body
Psycho bitches in my lobby
I got haters in the paper, photo shoots with paparazzi
Can't even take my daughter for a walk
See 'em by the corner store
I feel like I'm cornered off
Enough is enough, I'm callin' this off
Who the fuck I'm kiddin' though?
I'm gettin' high, sittin' low
Slidin' by in that big body, curtains all in my window
This fame hurt, but this chain worse
I think back you asked the same person
If this is all you had to deal with
Nigga, deal with, this shit ain't work
This light work, camera snappin', my eyes hurt
Niggas dying back where I was birthed
Fuck your iris and the IRS
Get the hell up off your high horse
You got the shit that niggas die for, dry yours
Why you mad? Take the good with the bad
Or throw the baby out with that bath water

[Bridge: Jay Z]
You still alive, still that nigga
Nigga, you survived, you still gettin' bigger
Nigga, living the life, vanilla wafers in a villa
Illest nigga alive; Michael Jackson's Thriller

[Chorus: Justin Timberlake]
And, baby, it's amazin' I'm in this maze with you
I just can't crack your code
One day you screamin' you love me loud
The next day you're so cold
One day you're here, one day you're there, one day you care
You're so unfair
Sippin' from your cup 'til it runneth over
Holy Grail

[Bridge: Justin Timberlake]
You get the air out my lungs whenever you need it
And you take the blade right out my heart
Just so you can watch me bleed
And I still don't know why, why I love you so much, yeah
(Thanks for warnin' me, thanks for warnin' me)
And you play this game in spite to drive me insane
I got it tattooed on my sleeve
Forever in ink with guess whose name
But I still don't know why, why our love is so much, yeah
(Thanks for warnin' me, thanks for warnin' me)

[Chorus: Justin Timberlake]
And, baby, it's amazin' I'm in this maze with you
I just can't crack your code
One day you screamin' you love me loud
The next day you're so cold
One day you're here, one day you're there, one day you care
You're so unfair
Sippin' from your cup 'til it runneth over
Holy Grail

[Produced by J-Roc, The-Dream & Timbaland]",Magna Carta... Holy Grail,6M,"July 4, 2013"
The Weeknd,Starboy,"[Verse 1]
I'm tryna put you in the worst mood, ah
P1 cleaner than your church shoes, ah
Milli point two just to hurt you, ah
All red Lamb’ just to tease you, ah
None of these toys on lease too, ah
Made your whole year in a week too, yah
Main bitch out your league too, ah
Side bitch out of your league too, ah

[Pre-Chorus]
House so empty, need a centerpiece
20 racks a table cut from ebony
Cut that ivory into skinny pieces
Then she clean it with her face man I love my baby
You talking money, need a hearing aid
You talking bout me, I don't see the shade
Switch up my style, I take any lane
I switch up my cup, I kill any pain

[Chorus]
Look what you've done
I’m a motherfuckin' starboy
Look what you've done
I'm a motherfuckin' starboy

[Verse 2]
Every day a nigga try to test me, ah
Every day a nigga try to end me, ah
Pull off in that Roadster SV, ah
Pockets overweight, gettin' hefty, ah
Coming for the king, that's a far cry, ah
I come alive in the fall time, I
No competition, I don't really listen
I’m in the blue Mulsanne bumping New Edition

[Pre-Chorus]
House so empty, need a centerpiece
20 racks a table cut from ebony
Cut that ivory into skinny pieces
Then she clean it with her face man I love my baby
You talking money, need a hearing aid
You talking bout me, I don’t see the shade
Switch up my style, I take any lane
I switch up my cup, I kill any pain

[Chorus]
Look what you've done
I’m a motherfuckin' starboy
Look what you've done
I'm a motherfuckin’ starboy

[Verse 3]
Let a nigga brag Pitt
Legend of the fall took the year like a bandit
Bought mama a crib and a brand new wagon
Now she hit the grocery shop looking lavish
Star Trek roof in that Wraith of Khan
Girls get loose when they hear this song
100 on the dash get me close to God
We don't pray for love, we just pray for cars

[Pre-Chorus]
House so empty, need a centerpiece
20 racks a table cut from ebony
Cut that ivory into skinny pieces
Then she clean it with her face man I love my baby
You talking money, need a hearing aid
You talking 'bout me, I don't see the shade
Switch up my style, I take any lane
I switch up my cup, I kill any pain

[Chorus]
Look what you've done
I'm a motherfuckin' starboy
Look what you've done
I'm a motherfuckin' starboy
Look what you've done
I'm a motherfuckin' starboy
Look what you've done
I'm a motherfuckin' starboy",Starboy,5.9M,"September 22, 2016"
Eminem,Killshot,"[Intro]
You sound like a bitch, bitch
Shut the fuck up
When your fans become your haters
You done?
Fuckin' beard's weird
Alright
You yellin' at the mic, fuckin' weird beard (You want smoke)
We doin' this once
You yellin' at the mic, your beard's weird
Why you yell at the mic? (Illa)

[Verse]
Rihanna just hit me on a text
Last night I left hickeys on her neck
Wait, you just dissed me? I'm perplexed
Insult me in a line, compliment me on the next
Damn, I'm really sorry you want me to have a heart attack
Was watchin' 8 Mile on my NordicTrack
Realized I forgot to call you back
Here's that autograph for your daughter, I wrote it on a Starter cap
Stan, Stan, son
Listen, man, Dad isn't mad
But how you gonna name yourself after a damn gun
And have a man-bun?
The giant's woke, eyes open, undeniable
Supplyin' smoke, got the fire stoked
Say you got me in a scope, but you grazed me
I say one call to Interscope and you're Swayze
Your reply got the crowd yelling, ""Woo!""
So before you die let's see who can out-petty who
With your corny lines (""Slim, you're old"")—ow, Kelly, ooh
But I'm 45 and I'm still outselling you
By 29, I had three albums that had blew
Now let's talk about somethin' I don't really do
Go in someone's daughter's mouth stealin' food
But you're a fuckin' mole hill
Now I'ma make a mountain out of you, woo!
Ho, chill, actin' like you put the chrome barrel to my bone marrow
Gunner? Bitch, you ain't a bow and arrow
Say you'll run up on me like a phone bill, sprayin' lead (Brrt)
Playin' dead, that's the only time you hold still (Hold up)
Are you eating cereal or oatmeal?
What the fuck's in the bowl, milk? Wheaties or Cheerios?
'Cause I'm takin' a shit in 'em, Kelly, I need reading material
…Dictionary…
""Yo, Slim, your last four albums sucked
Go back to Recovery,"" oh shoot, that was three albums ago
What do you know? Oops
Know your facts before you come at me, lil' goof
Luxury, oh, you broke, bitch? Yeah, I had enough money in '02
To burn it in front of you, ho
Younger me? No, you the wack me, it's funny but so true
I'd rather be 80-year-old me than 20-year-old you
'Til I'm hitting old age
Still can fill a whole page with a 10-year-old's rage
Got more fans than you in your own city, lil' kiddy, go play
Feel like I'm babysitting Lil Tay
Got the Diddy okay so you spent your whole day
Shootin' a video just to fuckin' dig your own grave
Got you at your own wake, I'm the billy goat
You ain't never made a list next to no Biggie, no Jay
Next to Taylor Swift and that Iggy ho, you about to really blow
Kelly, they'll be putting your name
Next to Ja, next to Benzino—die, motherfucker!
Like the last motherfucker sayin' Hailie in vain
Alien brain, you Satanist (Yeah)
My biggest flops are your greatest hits
The game's mine again and ain't nothin' changed but the locks
So before I slay this bitch I, mwah, give Jade a kiss
Gotta wake up Labor Day to this (The fuck?)
Bein' rich-shamed by some prick usin' my name for clickbait
In a state of bliss 'cause I said his goddamn name
Now I gotta cock back, aim
Yeah, bitch, pop Champagne to this! (Pop)
It's your moment
This is it, as big as you're gonna get, so enjoy it
Had to give you a career to destroy it
Lethal injection
Go to sleep six feet deep, I'll give you a B for the effort
But if I was three-foot-eleven
You'd look up to me, and for the record
You would suck a dick to fuckin' be me for a second
Lick a ballsack to get on my channel
Give your life to be as solidified
This mothafuckin' shit is like Rambo when he's out of bullets
So what good is a fuckin' machine gun when it's outta ammo?
Had enough of this tatted-up mumble rapper
How the fuck can him and I battle?
He'll have to fuck Kim in my flannel
I'll give him my sandals
'Cause he knows, long as I'm Shady he's gon' have to live in my shadow
Exhausting, letting off on my offspring
Lick a gun barrel, bitch, get off me!
You dance around it like a sombrero, we can all see
You're fuckin' salty
'Cause Young Gerald's balls-deep inside of Halsey
Your red sweater, your black leather
You dress better, I rap better
That a death threat or a love letter?
Little white toothpick
Thinks it's over a pic, I just don't like you, prick
Thanks for dissing me
Now I had an excuse on the mic to write ""Not Alike""
But really I don't care who's in the right
But you're losin' the fight you picked
Who else want it? Kells—attempt fails! Budden—L's!
Fuckin' nails in these coffins as soft as Cottonelle
Killshot, I will not fail, I'm with the Doc still
But this idiot's boss pops pills and tells him he's got skills
But, Kells, the day you put out a hit's the day Diddy admits
That he put the hit out that got Pac killed, ah!
I'm sick of you bein' wack
And still usin' that mothafuckin' Auto-Tune
So let's talk about it (Let's talk about it)
I'm sick of your mumble rap mouth
Need to get the cock up out it
Before we can even talk about it (Talk about it)
I'm sick of your blonde hair and earrings
Just 'cause you look in the mirror and think
That you're Marshall Mathers (Marshall Mathers)
Don't mean you are, and you're not about it
So just leave my dick in your mouth and keep my daughter out it

[Outro]
You fuckin'—oh
And I'm just playin', Diddy
You know I love you",NA,5.8M,"September 14, 2018"
Beyoncé,FORMATION,"[Intro: Messy Mya]
What happened at the New Wil'ins?
Bitch, I'm back by popular demand

[Refrain: Beyoncé]
Y'all haters corny with that Illuminati mess
Paparazzi, catch my fly and my cocky fresh
I'm so reckless when I rock my Givenchy dress (Stylin')
I'm so possessive so I rock his Roc necklaces
My daddy Alabama, momma Louisiana
You mix that negro with that Creole, make a Texas bama
I like my baby heir with baby hair and afros
I like my negro nose with Jackson Five nostrils
Earned all this money, but they never take the country out me
I got hot sauce in my bag, swag

[Interlude: Messy Mya & Big Freedia]
Oh yeah, baby, oh yeah I, ohhhhh, oh, yes, I like that
I did not come to play with you hoes, haha
I came to slay, bitch
I like cornbreads and collard greens, bitch
Oh, yes, you besta believe it

[Refrain: Beyoncé]
Y'all haters corny with that lluminati mess
Paparazzi, catch my fly and my cocky fresh
I'm so reckless when I rock my Givenchy dress (Stylin')
I'm so possessive so I rock his Roc necklaces
My daddy Alabama, momma Louisiana
You mix that negro with that Creole, make a Texas bama
I like my baby heir with baby hair and afros
I like my negro nose with Jackson Five nostrils
Earned all this money but they never take the country out me
I got hot sauce in my bag, swag

[Chorus: Beyoncé]
I see it, I want it, I stunt; yellow bone-it
I dream it, I work hard, I grind 'til I own it
I twirl on them haters, albino alligators
El Camino with the seat low, sippin' Cuervo with no chaser
Sometimes I go off (I go off), I go hard (I go hard)
Get what's mine (Take what's mine), I'm a star (I'm a star)
'Cause I slay (Slay), I slay (Hey), I slay (Okay), I slay (Okay)
All day (Okay), I slay (Okay), I slay (Okay), I slay (Okay)
We gon' slay (Slay), gon' slay (Okay), we slay (Okay), I slay (Okay)
I slay (Okay), okay (Okay), I slay (Okay), okay, okay, okay, okay
Okay, okay, ladies, now let's get in formation, 'cause I slay
Okay, ladies, now let's get in formation, 'cause I slay
Prove to me you got some coordination, 'cause I slay
Slay trick, or you get eliminated

[Verse: Beyoncé]
When he fuck me good, I take his ass to Red Lobster, 'cause I slay
When he fuck me good, I take his ass to Red Lobster, we gon slay
If he hit it right, I might take him on a flight on my chopper, I slay
Drop him off at the mall, let him buy some J's, let him shop up, 'cause I slay
I might get your song played on the radio station, 'cause I slay
I might get your song played on the radio station, 'cause I slay
You just might be a black Bill Gates in the making, 'cause I slay
I just might be a black Bill Gates in the making

[Chorus: Beyoncé]
I see it, I want it, I stunt; yellow bone-it
I dream it, I work hard, I grind 'til I own it
I twirl on them haters, albino alligators
El Camino with the seat low, sippin' Cuervo with no chaser
Sometimes I go off (I go off), I go hard (I go hard)
Take what's mine (Take what's mine), I'm a star (I'm a star)
'Cause I slay (Slay), I slay (Hey), I slay (Okay), I slay (Okay)
I slay (Okay), I slay (Okay), I slay (Okay), I slay (Okay)
We gon' slay (Slay), gon' slay (Okay), we slay (Okay), I slay (Okay)
I slay (Okay), okay (Okay), I slay (Okay), okay, okay, okay, okay
Okay, okay, ladies, now let's get in formation, I slay
Okay, ladies, now let's get in formation, 'cause I slay
Prove to me you got some coordination, 'cause I slay
Slay trick, or you get eliminated, I slay

[Bridge: Beyoncé]
Okay, ladies, now let's get in formation, I slay
Okay, ladies, now let's get in formation
You know you that bitch when you cause all this conversation
Always stay gracious, best revenge is your paper

[Outro]
Girl, I hear some thunder
Golly, look at that water, boy, oh Lord",Lemonade,5.7M,"February 6, 2016"
XXXTENTACION,Jocelyn Flores,"[Intro: Shiloh Dynasty]
I know you so well, so well
I mean, I can do anything that he can
I've been pretty—

[Bridge: XXXTENTACION & Shiloh Dynasty]
I know you're somewhere, somewhere
I've been trapped in my mind, girl, just holding on
I don't wanna pretend we're something, we're nothing
I've been stuck thinking 'bout her, I can't hold on (I'll be feeling)

[Verse: XXXTENTACION]
I'm in pain, wanna put ten shots in my brain
I've been trippin' 'bout some things, can't change
Suicidal, same time I'm tame
Picture this, in bed, get a phone call
Girl that you fucked with killed herself
That was this summer when nobody helped
And ever since then, man, I hate myself
Wanna fuckin' end it, pessimistic
All wanna see me with no pot to piss in
But niggas been excited 'bout the grave I'm diggin'
Havin' conversations 'bout my haste decisions
Fuckin' sickenin'; at the same time
Memories surface through the grapevine
'Bout my uncle playin' with a slip knot
Post-traumatic stress got me fucked up
Been fucked up since the couple months they had a nigga locked up

[Chorus: XXXTENTACION & Shiloh Dynasty]
I'll be feelin' pain, I'll be feelin' pain just to hold on
And I don't feel the same, I'm so numb
I'll be feelin' pain, I'll be feelin' pain just to hold on
And I don't feel the same, I'm so numb

[Outro: Shiloh Dynasty]
I know you so well (I know you, girl)
I mean, I can do better than he can
I've been pretty—
I know you so well",17,5.7M,"August 25, 2017"
Drake,One Dance,"[Intro: Kyla]
Baby, I like your style

[Verse 1: Drake]
Grips on your waist, front way, back way
You know that I don't play
Streets not safe but I never run away
Even when I'm away
Oti, oti
There's never much love when we go OT
I pray to make it back in one piece
I pray, I pray

[Chorus: Drake]
That's why I need a one dance
Got a Hennessy in my hand
One more time 'fore I go
Higher powers taking a hold on me
I need a one dance
Got a Hennessy in my hand
One more time 'fore I go
Higher powers taking a hold on me

[Refrain: Kyla]
Baby, I like your style

[Verse 2: Drake]
Strength and guidance
All that I'm wishing for my friends
Nobody makes it from my ends
I had to bust up the silence
You know you gotta stick by me
Soon as you see the text, reply me
I don't wanna spend time fighting
We've got no time

[Chorus: Drake]
And that's why I need a one dance
Got a Hennessy in my hand
One more time 'fore I go
Higher powers taking a hold on me
I need a one dance
Got a Hennessy in my hand
One more time 'fore I go
Higher powers taking a hold on me

[Bridge: Wizkid]
Got a pretty girl and she love me long time
Wine it, wine it, very long time
Oh yeah, very long time
Back up, back up, back up and wine it
Back up, back up and wine it, girl
Back up, back up, back up and wine it
Oh yeah, very long time
Back, up, back up and wine it, girl

[Refrain: Kyla + Wizkid]
Tell me
I need to know, where do you wanna go?
Cause if you're down, I'll take it slow
Make you lose control
Where, where, where
Where, where, where, where
Oh yeah, very long time
Where, where, where
Back, up, back up and wine it, girl
Where, where, where, where
Cause if you're down
Back up, back up and
Cause if you're down
Back up, back up and
Cause if you're down
Back up, back up and

[Chorus: Drake]
I need a one dance
Got a Hennessy in my hand
One more time 'fore I go
Higher powers taking a hold on me
I need a one dance
Got a Hennessy in my hand
One more time 'fore I go
Higher powers taking a hold on me",Views,5.7M,"April 5, 2016"
Desiigner,Panda,"[Intro]
This what they all been waitin' for
I guess so
They been waitin’ for this shit for a long time didn't they
I'ma give it everythin’ I got
Ayo Dougie park that X6 around the corner
Ayy I'm just feelin' my vibe right now
I'm feelin' myself

[Bridge]
Panda, Panda
Panda, Panda, Panda, Panda, Panda

[Chorus]
I got broads in Atlanta
Twistin' dope, lean, and the Fanta
Credit cards and the scammers
Hittin' off licks in the bando
Black X6, Phantom
White X6 look like a panda
Goin' out like I’m Montana
Hundred killas, hundred hammers
Black X6, Phantom
White X6, panda
Pockets swole, Danny
Sellin’ bar, candy
Man I'm the macho like Randy
The choppa go Oscar for Grammy
Bitch nigga pull up ya panty
Hope you killas understand me
I got broads in Atlanta
Twistin’ dope, lean, and the Fanta
Credit cards and the scammers
Hittin' off licks in the bando
Black X6, Phantom
White X6 look like a panda
Goin' out like I'm Montana
Hundred killas, hundred hammers
Black X6, Phantom
White X6, panda
Pockets swole, Danny
Sellin’ bar, candy
Man I'm the macho like Randy
The choppa go Oscar for Grammy
Bitch nigga pull up ya panty
Hope you killas understand me

[Bridge]
Hey
Panda, Panda
Panda, Panda, Panda, Panda, Panda, Panda, Panda, Panda

[Verse]
I got broads in Atlanta
Twistin' dope, lean, and shit, sippin' Fanta
Credit cards and the scammers
Wake up Versace shit, life Desiigner
Whole bunch of lavish shit
They be askin' 'round town who be clappin' shit
I be pullin' up stuff in the Phantom ship
I got plenty of stuff of Bugatti whip look how I drive this shit
Black X6, Phantom
White X6, killin' on camera
Pop a Perc, I can't stand up
Gorilla, they come and kill you with bananas
Four fillas, they finna pull up in the Phantom
Know niggas, they come and kill you on the camera
Big Rollie, it dancin' bigger than a Pandie
Go Oscar for Grammy, bitch pull up ya panty
Fill up I'ma flip it, I got bitches pull up and they get it
I got niggas that's countin' for digits
Say you make you a lot of new money
Know some killas pull off and they in the Wraith
CTD, pull up in the killa Bape
Call up Phillip-Phillip, gon' fill the bank
Niggas up in the bank, we gon' drill the bank
Fuck we gon' kill the bank, get it
I got broads, yea I get it
I get cards yea I shitted
This how I live it
Did it all for a ticket
Now Flex drop bombs when he spin it
And Bobby gon' trend it
Jeff The Don doin' business
Zana Ray fuckin' up shit and she doin' her business
I be gettin' to the chicken
Countin' to the chicken
And all of my niggas gon' split it

[Bridge]
Panda, Panda
Panda, Panda, Panda, Panda, Panda

[Chorus]
I got broads in Atlanta
Twistin' dope, lean, and the Fanta
Credit cards and the scammers
Hittin' off licks in the bando
Black X6, Phantom
White X6 look like a panda
Goin' out like I'm Montana
Hundred killas, hundred hammers
Black X6, Phantom
White X6, panda
Pockets swole, Danny
Sellin' bar, candy
Man I'm the macho like Randy
The choppa go Oscar for Grammy
Bitch nigga pull up ya panty
Hope you killas understand me
I got broads in Atlanta
Twistin' dope, lean, and the Fanta
Credit cards and the scammers
Hittin' off licks in the bando
Black X6, Phantom
White X6 look like a panda
Goin' out like I’m Montana
Hundred killas, hundred hammers
Black X6, Phantom
White X6, panda
Pockets swole, Danny
Sellin' bar, candy
Man I'm the macho like Randy
The choppa go Oscar for Grammy
Bitch nigga pull up ya panty
Hope you killas understand me

[Outro]
Panda, Panda
Panda, Panda, Panda, Panda, Panda

[Produced by Menace]",New English,5.5M,"December 15, 2015"
